年份,领域大类,tag,论文标题,作者,论文链接,项目链接
2021,机器学习系统,,"On the Efficiency of K-Means Clustering: Evaluation, Optimization, and Algorithm Selection","Sheng Wang, New York University; et al.",http://vldb.org/pvldb/vol14/p163-wang.pdf,https://github.com/tgbnhy/fast-kmeans
2021,机器学习系统,,Comprehensible Counterfactual Explanation on Kolmogorov-Smirnov Test,"Zicun Cong, Simon Fraser University; et al.",http://vldb.org/pvldb/vol14/p1583-cong.pdf,https://github.com/research0610/MOCHE
2021,机器学习系统,,GeCo: Quality Counterfactual Explanations in Real Time,"Maximilian Schleich, University of Washington; et al.",http://vldb.org/pvldb/vol14/p1681-schleich.pdf,https://github.com/mjschleich/GeCo.jl
2021,机器学习系统,,A Queueing-Theoretic Framework for Vehicle Dispatching in Dynamic Car-Hailing,"Peng Cheng, East China Normal University; et al.",http://vldb.org/pvldb/vol14/p2177-cheng.pdf,https://github.com/inabao/queue-based-order-dispatching
2021,大数据系统,,SetSketch: Filling the Gap between MinHash and HyperLogLog,"Otmar Ertl, Dynatrace Research; et al.",http://vldb.org/pvldb/vol14/p2244-ertl.pdf,https://github.com/dynatrace-research/set-sketch-paper
2021,机器学习系统,,LOCATER: Cleaning WiFi Connectivity Datasets for Semantic Localization,"Yiming Lin, University of California Irvine; et al.",http://vldb.org/pvldb/vol14/p329-lin.pdf,https://github.com/yiminl18/LOCATER
2021,机器学习系统,,CHEF: A Cheap and Fast Pipeline for Iteratively Cleaning Label Uncertainties,"Yinjun Wu, University of Pennsylvania; et al.",http://vldb.org/pvldb/vol14/p2410-wu.pdf,https://github.com/thuwuyinjun/Chef
2021,并行与分布式系统,,GraphMineSuite: Enabling High-Performance and Programmable Graph Mining Algorithms with Set Algebra,"Maciej Besta, ETH Zurich; et al.",http://vldb.org/pvldb/vol14/p1922-besta.pdf,https://graphminesuite.spcl.inf.ethz.ch
2021,并行与分布式系统,,A Comprehensive Survey and Experimental Comparison of Graph-Based Approximate Nearest Neighbor Search,"Mengzhao Wang, Hangzhou Dianzi University; et al.",http://vldb.org/pvldb/vol14/p1964-wang.pdf,https://github.com/Lsyhprum/WEAVESS
2021,并行与分布式系统,,Accelerating Exact Constrained Shortest Paths on GPUs,"Shengliang Lu, National University of Singapore; et al.",http://vldb.org/pvldb/vol14/p547-lu.pdf,https://github.com/xtra-computing/vine
2021,数据库系统,,Achieving High Throughput and Elasticity in a Larger-than-Memory Store,"Chinmay Kulkarni, University of Utah; et al.",http://vldb.org/pvldb/vol14/p1427-kulkarni.pdf,https://aka.ms/Shadowfax
2021,数据库系统,,PATSQL: Efficient Synthesis of SQL Queries from Example Tables with Quick Inference of Projected Columns,"Keita Takenouchi, NTT DATA; et al.",http://vldb.org/pvldb/vol14/p1937-takenouchi.pdf,https://github.com/NAIST-SE/PATSQL
2021,数据库系统,,Rumble: Data Independence for Large Messy Data Sets,"Ingo Müller, ETH Zürich; et al.",http://vldb.org/pvldb/vol14/p498-muller.pdf,https://github.com/RumbleDB/experiments-vldb21
2021,数据库系统,,Towards an Efficient Weighted Random Walk Domination,"Songsong Mo, Wuhan University; et al.",http://vldb.org/pvldb/vol14/p560-mo.pdf,https://github.com/songsong945/RandomWalkDomination
2021,数据库系统,,Adaptive Data Augmentation for Supervised Learning over Missing Data,"Tongyu Liu, Renmin University of China; et al.",http://vldb.org/pvldb/vol14/p1202-fan.pdf,https://github.com/ruc-datalab/dagan
2021,数据库系统,,Nearest Neighbor Classifiers over Incomplete Information: From Certain Answers to Certain Predictions,"Bojan Karlaš, ETH Zürich; et al.",http://vldb.org/pvldb/vol14/p255-karlas.pdf,https://github.com/chu-data-lab/CPClean
2021,数据库系统,,Are We Ready For Learned Cardinality Estimation?,"Xiaoying Wang, Simon Fraser University; et al.",http://vldb.org/pvldb/vol14/p1640-wang.pdf,https://github.com/sfu-db/AreCELearnedYet
2021,数据库系统,,Flow-Loss: Learning Cardinality Estimates That Matter,"Parimarjan Negi, MIT CSAIL; et al.",http://vldb.org/pvldb/vol14/p2019-negi.pdf,https://github.com/learnedsystems/ceb
2021,数据库系统,,NeuroCard: One Cardinality Estimator for All Tables,"Zongheng Yang, UC Berkeley; et al.",http://vldb.org/pvldb/vol14/p61-yang.pdf,https://github.com/neurocard
2021,数据库系统,,RECEIPT: REfine CoarsE-grained IndePendent Tasks for Parallel Tip decomposition of Bipartite Graphs,"Kartik Lakhotia, USC; et al.",http://vldb.org/pvldb/vol14/p404-lakhotia.pdf,https://github.com/kartiklakhotia/RECEIPT
2021,数据库系统,,Symmetric Continuous Subgraph Matching with Bidirectional Dynamic Programming,"Seunghwan Min, Seoul National University; et al.",http://vldb.org/pvldb/vol14/p1298-han.pdf,https://github.com/SNUCSE-CTA/SymBi
2021,数据库系统,,"The Case for NLP-Enhanced Database Tuning: Towards Tuning Tools that ""Read the Manual""","Immanuel Trummer, Cornell; et al.",http://vldb.org/pvldb/vol14/p1159-trummer.pdf,https://tinyurl.com/9crrjezv
2021,数据库系统,,Quality of Sentiment Analysis Tools: The Reasons of Inconsistency,"Wissam Mammar Kouadri, University of Paris; et al.",http://vldb.org/pvldb/vol14/p668-kouadri.pdf,https://github.com/AbCd256/Quality-of-sentiment-analysis-tools.git
2021,数据库系统,,CBench: Towards Better Evaluation of Question Answering Over Knowledge Graphs,"Abdelghny Orogat, Carleton University; et al.",http://vldb.org/pvldb/vol14/p1325-orogat.pdf,https://github.com/aorogat/CBench
2021,数据库系统,,Explaining Inference Queries with Bayesian Optimization,"Brandon Lockhart, Simon Fraser University; et al.",http://vldb.org/pvldb/vol14/p2576-lockhart.pdf,https://github.com/sfu-db/BOExplain
2021,数据库系统,,Data Acquisition for Improving Machine Learning Models,"Yifan Li, York University; et al.",http://vldb.org/pvldb/vol14/p1832-li.pdf,https://github.com/AwesomeYifan/Data-acquisition-for-ML
2021,数据库系统,,"In the Land of Data Streams where Synopses are Missing, One Framework to Bring Them All","Rudi Poepsel-Lemaitre, Technische Universität Berlin; et al.",http://vldb.org/pvldb/vol14/p1818-poepsel-lemaitre.pdf,https://github.com/TU-Berlin-DIMA/Condor
2021,数据库系统,,PR-Sketch: Monitoring Per-key Aggregation of Streaming Data with Nearly Full Accuracy,"Qun Huang, Peking University; et al.",http://vldb.org/pvldb/vol14/p1783-huang.pdf,https://github.com/N2-Sys/PR-Sketch
2021,数据库系统,,Ananke: A Streaming Framework for Live Forward Provenance,"Dimitris Palyvos-Giannas, Chalmers University of Technology; et al.",http://vldb.org/pvldb/vol14/p391-palyvos-giannas.pdf,https://github.com/dmpalyvos/ananke
2021,数据库系统,,Collective Influence Maximization for Multiple Competing Products with an Awareness-to-Influence Model,"Dimitris Tsaras, HKUST; et al.",http://vldb.org/pvldb/vol14/p1124-papadias.pdf,https://github.com/dtsaras/GCW
2021,数据库系统,,Shortest Paths and Centrality in Uncertain Networks,"Arkaprava Saha, Nanyang Technological University; et al.",http://vldb.org/pvldb/vol14/p1188-khan.pdf,https://github.com/ArkaSaha/MPSP-Centrality
2021,数据库系统,,NOAH: Interactive Spreadsheet Exploration with Dynamic Hierarchical Overviews,"Sajjadur Rahman, Megagon Labs; et al.",http://vldb.org/pvldb/vol14/p970-rahman.pdf,https://github.com/dataspread/NOAH
2021,数据库系统,,LES3: Learning-based exact set similarity search,"Yifan Li, York University; et al.",http://vldb.org/pvldb/vol14/p2073-li.pdf,https://github.com/AwesomeYifan/learning-based-set-sim-search
2021,数据库系统,,Improving Execution Efficiency of Just-in-time Compilation based Query Processing on GPUs,"Johns Paul, NUS; et al.",http://vldb.org/pvldb/vol14/p202-paul.pdf,https://github.com/Xtra-Computing/Pyper
2021,数据库系统,,Scotch: Generating FPGA-Accelerators for Sketching at Line Rate,"Martin Kiefer, TU Berlin; et al.",http://vldb.org/pvldb/vol14/p281-kiefer.pdf,https://github.com/martinkiefer/Scotch
2021,数据库系统,,FlexPushdownDB: Hybrid Pushdown and Caching in a Cloud DBMS,"Yifei Yang, University of California San Diego; et al.",http://vldb.org/pvldb/vol14/p2101-yang.pdf,https://github.com/cloud-olap/FlexPushdownDB
2021,数据库系统,,Understanding the Idiosyncrasies of Real Persistent Memory,"Shashank Gugnani, The Ohio State University; et al.",http://vldb.org/pvldb/vol14/p626-gugnani.pdf,https://github.com/padsys/PMIdioBench
2021,数据库系统,,Persistent Memory Hash Indexes: An Experimental Evaluation,"Daokun Hu, College of Computer Science and Electronic Engineering Hunan University China; et al.",http://vldb.org/pvldb/vol14/p785-chen.pdf,https://github.com/daokunhu/HashEvaluation
2021,数据库系统,,Viper: An Efficient Hybrid PMem-DRAM Key-Value Store,"Lawrence Benson, Hasso Plattner Institute University of Potsdam; et al.",http://vldb.org/pvldb/vol14/p1544-benson.pdf,https://github.com/hpides/viper
2021,机器学习系统,,VolcanoML: Speeding up End-to-End AutoML via Scalable Search Space Decomposition,"Yang Li, Peking University; et al.",http://vldb.org/pvldb/vol14/p2167-li.pdf,https://github.com/PKU-DAIR/mindware
2021,机器学习系统,,Doing More with Less: Characterizing Dataset Downsampling for AutoML,"Fatjon Zogaj, ETH Zurich; et al.",http://vldb.org/pvldb/vol14/p2059-zogaj.pdf,https://github.com/ipa-lab/autoML-sampling-public
2021,数据库系统,,Scaling Replicated State Machines with Compartmentalization,"Michael J Whittaker, UC Berkeley; et al.",http://vldb.org/pvldb/vol14/p2203-whittaker.pdf,https://github.com/mwhittaker/frankenpaxos
2021,数据库系统,,Hindsight Logging for Model Training,"Rolando Garcia, UC Berkeley; et al.",http://vldb.org/pvldb/vol14/p682-garcia.pdf,https://github.com/ucbrise/flor
2021,大数据系统,,Capturing and querying fine-grained provenance of preprocessing pipelines in data science,"Adriane Chapman, University of Southampton; et al.",http://vldb.org/pvldb/vol14/p507-chapman.pdf,https://github.com/GiuliaSim/DataProvenance
2021,大数据系统,,Fine-Grained Lineage for Safer Notebook Interactions,"Stephen Macke, University of Illinois at Urbana-Champaign; et al.",http://vldb.org/pvldb/vol14/p1093-macke.pdf,https://github.com/nbsafety-project
2021,数据库系统,,A four-dimensional Analysis of Partitioned Approximate Filters,"Tobias Schmidt, TUM; et al.",http://vldb.org/pvldb/vol14/p2355-schmidt.pdf,https://github.com/tum-db/partitioned-filters
2021,大数据系统,,Automated Feature Engineering for Algorithmic Fairness,"Ricardo Salazar, TU Berlin; et al.",http://vldb.org/pvldb/vol14/p1694-neutatz.pdf,https://github.com/RicardoSD/FairExp
2021,系统安全与隐私,,Data Synthesis via Differentially Private Markov Random Field,"Kuntai Cai, National University of Singapore; et al.",http://vldb.org/pvldb/vol14/p2190-cai.pdf,https://github.com/caicre/PrivMRF
2021,系统安全与隐私,,Differentially Private Binary- and Matrix-Valued Data Query: An XOR Mechanism,"Tianxi Ji, Case Western Reserve University; et al.",http://vldb.org/pvldb/vol14/p849-ji.pdf,https://github.com/nestgroup/The-XOR-mechanism
2021,数据库系统,,Teseo and the Analysis of Structural Dynamic Graphs,"Dean De Leo, Centrum Wiskunde &amp; Informatica; et al.",http://vldb.org/pvldb/vol14/p1053-leo.pdf,https://github.com/cwida/gfe_driver
2021,数据库系统,,Exathlon: A Benchmark for Explainable Anomaly Detection over Time Series,"Vincent Jacob, Ecole Polytechnique; et al.",http://vldb.org/pvldb/vol14/p2613-tatbul.pdf,https://github.com/exathlonbenchmark/exathlon
2021,数据库系统,,ORBITS: Online Recovery of Missing Values in Multiple Time Series Streams,"Mourad Khayati, University of Fribourg; et al.",http://vldb.org/pvldb/vol14/p294-khayati.pdf,https://github.com/eXascaleInfolab/orbits
2021,数据库系统,,Heracles: An Efficient Storage Model And Data Flushing For Performance Monitoring Timeseries,"Zhiqi Wang, The Chinese University of HK; et al.",http://vldb.org/pvldb/vol14/p1080-wang.pdf,https://github.com/naivewong/heracles
2021,机器学习系统,,DBTagger: Multi-Task Learning for Keyword Mapping in NLIDBs Using Bi-Directional Recurrent Neural Networks,"Arif Usta, Bilkent University; et al.",http://vldb.org/pvldb/vol14/p813-usta.pdf,https://github.com/arifusta/DBTagger
2021,机器学习系统,,Analyzing and Mitigating Data Stalls in DNN Training,"Jayashree Mohan, UT Austin; et al.",http://vldb.org/pvldb/vol14/p771-mohan.pdf,https://github.com/msr-fiddle/DS-Analyzer
2021,机器学习系统,,Progressive Compressed Records: Taking a Byte out of Deep Learning Data,"Michael Kuchnik, Carnegie Mellon University; et al.",http://vldb.org/pvldb/vol14/p2627-kuchnik.pdf,https://github.com/mkuchnik/PCR_Release
2021,数据库系统,,Benchmarking Learned Indexes,"Ryan C Marcus, MIT; et al.",http://vldb.org/pvldb/vol14/p1-marcus.pdf,https://learned.systems/sosd
2021,数据库系统,,Scalable Structural Index Construction for JSON Analytics,"Lin Jiang, University of California Riverside; et al.",http://vldb.org/pvldb/vol14/p694-zhao.pdf,https://github.com/AutomataLab/Pison
2021,机器学习系统,,Deep Entity Matching with Pre-Trained Language Models,"Yuliang Li, Megagon Labs; et al.",http://vldb.org/pvldb/vol14/p50-li.pdf,https://github .com/megagonlabs/ditto
2021,机器学习系统,,Deep Learning for Blocking in Entity Matching: A Design Space Exploration,"Saravanan Thirumuruganathan, QCRI; et al.",http://vldb.org/pvldb/vol14/p2459-thirumuruganathan.pdf,https://github.com/saravanan-thirumuruganathan/DeepBlocker
2021,机器学习系统,,Dual-Objective Fine-Tuning of BERT for Entity Matching,"Ralph Peeters, University of Mannheim; et al.",http://vldb.org/pvldb/vol14/p1913-peeters.pdf,https://github.com/wbsg-uni-mannheim/jointbert
2021,机器学习系统,,Accelerating Large Scale Real-Time GNN Inference using Channel Pruning,"hongkuan zhou, University of Southern California; et al.",http://vldb.org/pvldb/vol14/p1597-zhou.pdf,https://github.com/tedzhouhk/GCNP
2021,机器学习系统,,Large Graph Convolutional Network Training with GPU-Oriented Data Communication Architecture,"Seung Won Min, University of Illinois at Urbana-Champaign; et al.",http://vldb.org/pvldb/vol14/p2087-min.pdf,https://github.com/K-Wu/pytorch-direct_dgl
2021,数据库系统,,CoroBase: Coroutine-Oriented Main-Memory Database Engine,"Yongjun He, Simon Fraser University; et al.",http://vldb.org/pvldb/vol14/p431-he.pdf,https://github.com/sfu-dis/corobase/tree/v1.0
2021,数据库系统,,Constructing and Analyzing the LSM Compaction Design Space,"Subhadeep Sarkar, Boston University; et al.",http://vldb.org/pvldb/vol14/p2216-sarkar.pdf,https://disc.bu.edu/lsm-compaction
2021,机器学习系统,,FREDE: Anytime Graph Embeddings,"Anton Tsitsulin, University of Bonn; et al.",http://vldb.org/pvldb/vol14/p1102-mottin.pdf,https://github.com/xgfs/frede
2021,机器学习系统,,TURL: Table Understanding through Representation Learning,"Xiang Deng, The Ohio State University; et al.",http://vldb.org/pvldb/vol14/p307-deng.pdf,https://github.com/sunlab-osu/TURL
2021,并行与分布式系统,,ByShard: Sharding in a Byzantine Environment,"Jelle Hellings, University of California Davis; et al.",http://vldb.org/pvldb/vol14/p2230-hellings.pdf,https://www.jhellings.nl/projects/byshard
2021,系统安全与隐私,,CALYPSO: Private Data Management for Decentralized Ledgers,"Eleftherios Kokoris Kogias, IST Austria; et al.",http://vldb.org/pvldb/vol14/p586-kogias.pdf,https://github.com/calypso-demo
2021,系统安全与隐私,,SlimChain: Scaling Blockchain Transactions through Off-Chain Storage and Parallel Processing,"Cheng Xu, Hong Kong Baptist University; et al.",http://vldb.org/pvldb/vol14/p2314-xu.pdf,https://github.com/hkbudb/slimchain
2021,机器学习系统,,Scalable Community Detection via Parallel Correlation Clustering,"Jessica Shi, MIT; et al.",http://vldb.org/pvldb/vol14/p2305-shi.pdf,https://github.com/jeshi96/parallel-correlation-clustering
2021,机器学习系统,,Scalable Mining of Maximal Quasi-Cliques: An Algorithm-System Codesign Approach,"Guimu Guo, The University of Alabama at Birmingham; et al.",http://vldb.org/pvldb/vol14/p573-guo.pdf,https://github.com/yanlab19870714/gthinkerQC
2021,数据库系统,,Database Isolation By Scheduling,"Kevin P Gaffney, University of Wisconsin-Madison; et al.",http://vldb.org/pvldb/vol14/p1467-gaffney.pdf,https://github.com/UWHustle/dibs
2021,系统安全与隐私,,Budget Sharing for Multi-Analyst Differential Privacy,"David A Pujol, Duke University; et al.",http://vldb.org/pvldb/vol14/p1805-pujol.pdf,https://github.com/yikai-wu/Multi-Analyst-DP
2021,系统安全与隐私,,Frequency Estimation under Local Differential Privacy,"Graham Cormode, University of Warwick; et al.",http://vldb.org/pvldb/vol14/p2046-cormode.pdf,https://github.com/Samuel-Maddock/pure-LDP
2021,机器学习系统,,ParaX: Boosting Deep Learning for Big Data Analytics on Many-Core CPUs,"Lujia Yin, NUDT; et al.",http://vldb.org/pvldb/vol14/p864-zhang.pdf,https://github.com/nicexlab/parax-source
2021,并行与分布式系统,,Elle: Inferring Isolation Anomalies from Experimental Observations,"Peter Alvaro, UC Santa Cruz; et al.",http://vldb.org/pvldb/vol14/p268-alvaro.pdf,https://github.com/jepsen-io/jepsen
2021,数据库系统,,"Beyond Equi-joins: Ranking, Enumeration and Factorization","Nikolaos Tziavelis, Northeastern University; et al.",http://vldb.org/pvldb/vol14/p2599-tziavelis.pdf,https://github.com/northeastern-datalab/anyk-code
2021,数据库系统,,Stacked Filters: Learning to Filter by Structure,"Kyle B Deeds, Harvard University; et al.",http://vldb.org/pvldb/vol14/p600-hentschel.pdf,https://bitbucket.org/HarvardDASlab/stackedfilters
2021,数据库系统,,Charting the Design Space of Query Execution using VOILA,"Tim Gubner, CWI; et al.",http://vldb.org/pvldb/vol14/p1067-gubner.pdf,https://github.com/t1mm3/vldb_voila
2021,数据库系统,,Columnar Storage and List-based Processing for Graph Database Management Systems,"Pranjal Gupta, University of Waterloo; et al.",http://vldb.org/pvldb/vol14/p2491-gupta.pdf,https://github.com/graphflow/graphflow-columnar-techniques
2021,数据库系统,,Materializing Knowledge Bases via Trigger Graphs,"Efthymia Tsamoura, Samsung AI Research; et al.",http://vldb.org/pvldb/vol14/p943-tsamoura.pdf,https://github.com/karmaresearch/glog